{
  "cadence": "quality-review",
  "cc_version": "unknown",
  "ended": "2026-10-27T05:28:54Z",
  "escalations": [
    {
      "evidence": "run ended without a partial; no metrics were reported",
      "severity": "red",
      "summary": "quality-review run failed on acmeapi"
    }
  ],
  "host": "cloud",
  "lock": "unverified",
  "metrics": {},
  "next_action": "Investigate why quality-review produced no verdict on acmeapi.",
  "notes": "run ended without a partial; no metrics were reported",
  "project": "acmeapi",
  "run_id": "01M5XXAF7ZTQ2BGTFQXHP84N40",
  "schema_version": 1,
  "started": "2026-10-27T05:28:54Z",
  "status": "failed",
  "tier": "cloud",
  "verdict": "red"
}
