{
  "cadence": "docs-sync",
  "cc_version": "unknown",
  "ended": "2026-10-26T03:36:02Z",
  "escalations": [
    {
      "evidence": "run ended without a partial; no metrics were reported",
      "severity": "red",
      "summary": "docs-sync run failed on paysvc"
    }
  ],
  "host": "cloud",
  "lock": "unverified",
  "metrics": {},
  "next_action": "Investigate why docs-sync produced no verdict on paysvc.",
  "notes": "run ended without a partial; no metrics were reported",
  "project": "paysvc",
  "run_id": "01M5V4F267XRW4PRTX0RWB5AW1",
  "schema_version": 1,
  "started": "2026-10-26T03:36:01Z",
  "status": "failed",
  "tier": "cloud",
  "verdict": "red"
}
