{
  "cadence": "quality-review",
  "cc_version": "unknown",
  "ended": "2026-10-20T05:28:00Z",
  "escalations": [
    {
      "evidence": "run ended without a partial; no metrics were reported",
      "severity": "red",
      "summary": "quality-review run failed on jumpstart"
    }
  ],
  "host": "cloud",
  "lock": "unverified",
  "metrics": {},
  "next_action": "Investigate why quality-review produced no verdict on jumpstart.",
  "notes": "run ended without a partial; no metrics were reported",
  "project": "jumpstart",
  "run_id": "01M5BWFRMPED0XQ21NKAW95RTZ",
  "schema_version": 1,
  "started": "2026-10-20T05:27:56Z",
  "status": "failed",
  "tier": "cloud",
  "verdict": "red"
}
