{
  "cadence": "security-review",
  "cc_version": "unknown",
  "ended": "2026-10-29T08:26:26Z",
  "escalations": [
    {
      "evidence": "run ended without a partial; no metrics were reported",
      "severity": "red",
      "summary": "security-review run failed on autofillapp"
    }
  ],
  "host": "cloud",
  "lock": "unverified",
  "metrics": {},
  "next_action": "Investigate why security-review produced no verdict on autofillapp.",
  "notes": "run ended without a partial; no metrics were reported",
  "project": "autofillapp",
  "run_id": "01M63C8YPY3AKMGK8MB7C094ZV",
  "schema_version": 1,
  "started": "2026-10-29T08:26:25Z",
  "status": "failed",
  "tier": "cloud",
  "verdict": "red"
}
