{
  "cadence": "security-review",
  "cc_version": "unknown",
  "ended": "2026-10-15T07:32:13Z",
  "escalations": [
    {
      "evidence": "run ended without a partial; no metrics were reported",
      "severity": "red",
      "summary": "security-review run failed on acmeweb"
    }
  ],
  "host": "cloud",
  "lock": "unverified",
  "metrics": {},
  "next_action": "Investigate why security-review produced no verdict on acmeweb.",
  "notes": "run ended without a partial; no metrics were reported",
  "project": "acmeweb",
  "run_id": "01M4Z7KMMWCNJS6DS2R03QK9B3",
  "schema_version": 1,
  "started": "2026-10-15T07:32:10Z",
  "status": "failed",
  "tier": "cloud",
  "verdict": "red"
}
