{
  "cadence": "quality-review",
  "cc_version": "unknown",
  "ended": "2026-10-27T05:28:56Z",
  "escalations": [
    {
      "evidence": "run ended without a partial; no metrics were reported",
      "severity": "red",
      "summary": "quality-review run failed on audiosvc"
    }
  ],
  "host": "cloud",
  "lock": "unverified",
  "metrics": {},
  "next_action": "Investigate why quality-review produced no verdict on audiosvc.",
  "notes": "run ended without a partial; no metrics were reported",
  "project": "audiosvc",
  "run_id": "01M5XXAGMKFE0KYTREKBEA8RRS",
  "schema_version": 1,
  "started": "2026-10-27T05:28:54Z",
  "status": "failed",
  "tier": "cloud",
  "verdict": "red"
}
