{
  "cadence": "docs-sync",
  "cc_version": "unknown",
  "ended": "2026-10-19T03:33:39Z",
  "escalations": [
    {
      "evidence": "run ended without a partial; no metrics were reported",
      "severity": "red",
      "summary": "docs-sync run failed on classbot"
    }
  ],
  "host": "cloud",
  "lock": "unverified",
  "metrics": {},
  "next_action": "Investigate why docs-sync produced no verdict on classbot.",
  "notes": "run ended without a partial; no metrics were reported",
  "project": "classbot",
  "run_id": "01M593HNTZ27YX1BSSZ820T4RC",
  "schema_version": 1,
  "started": "2026-10-19T03:33:36Z",
  "status": "failed",
  "tier": "cloud",
  "verdict": "red"
}
