{
  "cadence": "security-review",
  "cc_version": "unknown",
  "ended": "2026-10-22T07:34:07Z",
  "escalations": [
    {
      "evidence": "run ended without a partial; no metrics were reported",
      "severity": "red",
      "summary": "security-review run failed on jumpstart"
    }
  ],
  "host": "cloud",
  "lock": "unverified",
  "metrics": {},
  "next_action": "Investigate why security-review produced no verdict on jumpstart.",
  "notes": "run ended without a partial; no metrics were reported",
  "project": "jumpstart",
  "run_id": "01M5H8G566ZCMKQW6AYGN7MQRF",
  "schema_version": 1,
  "started": "2026-10-22T07:34:06Z",
  "status": "failed",
  "tier": "cloud",
  "verdict": "red"
}
