{
  "cadence": "docs-sync",
  "cc_version": "unknown",
  "ended": "2026-10-15T03:30:47Z",
  "escalations": [
    {
      "evidence": "run ended without a partial; no metrics were reported",
      "severity": "red",
      "summary": "docs-sync run failed on dartboard"
    }
  ],
  "host": "cloud",
  "lock": "unverified",
  "metrics": {},
  "next_action": "Investigate why docs-sync produced no verdict on dartboard.",
  "notes": "run ended without a partial; no metrics were reported",
  "project": "dartboard",
  "run_id": "01M4YSSHBR16CTZ0VG2G1M12TE",
  "schema_version": 1,
  "started": "2026-10-15T03:30:45Z",
  "status": "failed",
  "tier": "cloud",
  "verdict": "red"
}
