{
  "cadence": "docs-sync",
  "cc_version": "unknown",
  "ended": "2026-10-22T03:31:08Z",
  "escalations": [
    {
      "evidence": "run ended without a partial; no metrics were reported",
      "severity": "red",
      "summary": "docs-sync run failed on workloados"
    }
  ],
  "host": "cloud",
  "lock": "unverified",
  "metrics": {},
  "next_action": "Investigate why docs-sync produced no verdict on workloados.",
  "notes": "run ended without a partial; no metrics were reported",
  "project": "workloados",
  "run_id": "01M5GTK7GJ253P2PJK4BWHKX9Y",
  "schema_version": 1,
  "started": "2026-10-22T03:31:07Z",
  "status": "failed",
  "tier": "cloud",
  "verdict": "red"
}
